{
  "_readme": "Single source of truth for the default palette (the theme every other theme is measured against) and for the OAuth pages' palette subset. The full light/dark token maps feed the TS theme module (styles/themes/default.ts keeps its ThemeDefinition shape but takes the palettes from the generated module) and scripts/generate-notice.mjs; the oauthPage subset -- a curated token list the server-rendered consent pages carry inline, because CSP default-src none forbids linking the SPA stylesheet -- is emitted as a Go CSS block with the documented --danger-subtle to --lm-danger-subtle rename (the page has no lm- namespace to keep).",
  "light": {
    "--background": "rgb(255 254 252)",
    "--foreground": "rgb(34 32 30)",
    "--card": "rgb(247 245 242)",
    "--card-foreground": "rgb(34 32 30)",
    "--primary": "rgb(13 148 136)",
    "--primary-foreground": "rgb(255 255 255)",
    "--secondary": "rgb(232 230 225)",
    "--secondary-foreground": "rgb(46 43 40)",
    "--muted": "rgb(237 235 231)",
    "--muted-foreground": "rgb(120 117 111)",
    "--faint": "rgb(242 240 236)",
    "--faint-foreground": "rgb(160 157 151)",
    "--accent": "rgb(222 235 225)",
    "--accent-foreground": "rgb(34 32 30)",
    "--danger": "rgb(220 74 68)",
    "--danger-foreground": "rgb(255 255 255)",
    "--success": "rgb(101 163 13)",
    "--success-foreground": "rgb(255 255 255)",
    "--warning": "rgb(245 158 11)",
    "--warning-foreground": "rgb(34 32 30)",
    "--border": "rgb(221 217 211)",
    "--input": "rgb(213 209 203)",
    "--ring": "rgb(13 148 136)",
    "--scrollbar-thumb": "rgb(from var(--muted-foreground) r g b / 0.35)",
    "--scrollbar-thumb-hover": "rgb(from var(--muted-foreground) r g b / 0.55)",
    "--scrollbar-track": "transparent",
    "--lm-bg-translucent": "rgba(255, 254, 252, 0.5)",
    "--lm-danger-subtle": "rgb(253 235 233)",
    "--lm-success-subtle": "rgb(236 247 220)",
    "--lm-warning-subtle": "rgb(254 245 221)",
    "--lm-icon-monochrome": "rgb(101 99 99)"
  },
  "dark": {
    "--background": "rgb(26 25 23)",
    "--foreground": "rgb(232 230 225)",
    "--card": "rgb(42 40 38)",
    "--card-foreground": "rgb(232 230 225)",
    "--primary": "rgb(20 184 166)",
    "--primary-foreground": "rgb(12 12 11)",
    "--secondary": "rgb(51 48 45)",
    "--secondary-foreground": "rgb(224 221 216)",
    "--muted": "rgb(46 43 40)",
    "--muted-foreground": "rgb(138 134 128)",
    "--faint": "rgb(36 34 32)",
    "--faint-foreground": "rgb(107 104 98)",
    "--accent": "rgb(45 62 50)",
    "--accent-foreground": "rgb(232 230 225)",
    "--danger": "rgb(239 83 80)",
    "--danger-foreground": "rgb(255 255 255)",
    "--success": "rgb(132 204 22)",
    "--success-foreground": "rgb(12 12 11)",
    "--warning": "rgb(251 191 36)",
    "--warning-foreground": "rgb(26 25 23)",
    "--border": "rgb(61 58 54)",
    "--input": "rgb(61 58 54)",
    "--ring": "rgb(20 184 166)",
    "--scrollbar-thumb": "rgb(from var(--muted-foreground) r g b / 0.35)",
    "--scrollbar-thumb-hover": "rgb(from var(--muted-foreground) r g b / 0.55)",
    "--scrollbar-track": "transparent",
    "--lm-bg-translucent": "rgba(26, 25, 23, 0.5)",
    "--lm-danger-subtle": "rgb(50 30 28)",
    "--lm-success-subtle": "rgb(28 38 20)",
    "--lm-warning-subtle": "rgb(46 40 24)",
    "--lm-icon-monochrome": "rgb(190 187 183)",
    "--lm-opencode-inner": "#4B4646",
    "--lm-opencode-outer": "#F1ECEC"
  },
  "oauthPage": {
    "tokens": [
      "--background",
      "--foreground",
      "--card",
      "--border",
      "--input",
      "--muted",
      "--muted-foreground",
      "--primary",
      "--primary-foreground",
      "--accent",
      "--danger",
      "--danger-subtle"
    ],
    "renames": {
      "--danger-subtle": "--lm-danger-subtle"
    }
  }
}
